{
  "asset_id": "arm-twp-ice-convective-column/v1",
  "columns": [
    {
      "independent_reference": {
        "cloud_base_mass_flux_kg_m2_s": 0.04137084155427549,
        "downward_interface_mass_flux_kg_m2_s": [
          0.0,
          0.00028054401140985,
          0.0367136063143449,
          0.06589349783616638,
          0.06256570862284984,
          0.05870822636239782,
          0.054111086433479956,
          0.05175163718993683,
          0.05028103155741593,
          0.04876792282568669,
          0.047813367219114035,
          0.0472451074444043,
          0.04600861437151325,
          0.04562905875413622,
          0.046246367142993856,
          0.0456227061084273,
          0.04511773252433411,
          0.045810374860692976,
          0.04479548430787282,
          0.04653137561297929,
          0.04562454299635352,
          0.04532537969349383,
          0.045101803065375534,
          0.04601537638191291,
          0.04786455610351746,
          0.04947205890381138,
          0.0495943416412917,
          0.04996706874259221,
          0.05059623759879368,
          0.05023180301694702,
          0.050135727936653024,
          0.0507169880602089,
          0.05160911427682005,
          0.05147108344626436,
          0.05293864257162598,
          0.0553554634037122,
          0.05785617217588817,
          0.04933714827395262
        ],
        "flag": 1,
        "maximum_generator_column_residual_s-1": 9.40108605654473e-12,
        "minimum_generator_off_diagonal_s-1": -8.3686890664452e-13,
        "upward_interface_mass_flux_kg_m2_s": [
          0.0,
          0.0002805451124590404,
          0.036713606743652615,
          0.06589349761517029,
          0.06256571089220822,
          0.0587082281487292,
          0.05411108857470129,
          0.05175164150133506,
          0.050281037875915716,
          0.04876792917299683,
          0.04781337209912174,
          0.04724511118652554,
          0.04600861751664183,
          0.04562905953787319,
          0.04624637055959817,
          0.045622707625758145,
          0.04511773538363332,
          0.04581037693773564,
          0.04479548375711886,
          0.04653136999504786,
          0.04562453877673067,
          0.04532537718606494,
          0.04510179970317142,
          0.04601537363980197,
          0.04786455385940079,
          0.04947205611221174,
          0.04959434102552712,
          0.04996706987383974,
          0.05059623929855893,
          0.05023180443099355,
          0.05013573049054419,
          0.050716989796324996,
          0.051609115374006975,
          0.0514710839930482,
          0.05293864240728449,
          0.05535546280475274,
          0.05785617351959116,
          0.04933714730432311
        ]
      },
      "observed_precipitation_mm_h": 0.8446824550628662,
      "thermodynamic_column": {
        "height_asl_m": [
          21887.737787438207,
          19041.096304698058,
          17239.781795111943,
          15884.827048557709,
          14744.096409695798,
          13744.767549232858,
          12851.022916799999,
          12040.001559485027,
          11296.614734142826,
          10609.77173916695,
          9970.795493225636,
          9373.199764854457,
          8811.724513274434,
          8282.178228847013,
          7781.292360713065,
          7306.092927973886,
          6853.957486755148,
          6422.770480627556,
          6010.6038111724565,
          5615.817500451658,
          5236.897435629916,
          4872.441964095885,
          4521.190162525184,
          4181.938549224224,
          3853.720210023156,
          3535.7940333311803,
          3227.693829679581,
          2928.8941772579183,
          2638.693733207538,
          2356.5908641810684,
          2082.1660949298885,
          1814.896155280644,
          1554.3247105602923,
          1300.1460935829114,
          1052.0069160924115,
          809.5140202735533,
          572.3388325703771,
          340.2494433840865,
          113.08583956274603
        ],
        "pressure_layer_mass_kg_m2": [
          255.1020408163265,
          255.1020408163265,
          255.1020408163265,
          255.1020408163265,
          255.1020408163265,
          255.1020408163265,
          255.1020408163265,
          255.1020408163265,
          255.1020408163265,
          255.1020408163265,
          255.1020408163265,
          255.1020408163265,
          255.1020408163265,
          255.1020408163265,
          255.1020408163265,
          255.1020408163265,
          255.1020408163265,
          255.1020408163265,
          255.1020408163265,
          255.1020408163265,
          255.1020408163265,
          255.1020408163265,
          255.1020408163265,
          255.1020408163265,
          255.1020408163265,
          255.1020408163265,
          255.1020408163265,
          255.1020408163265,
          255.1020408163265,
          255.1020408163265,
          255.1020408163265,
          255.1020408163265,
          255.1020408163265,
          255.1020408163265,
          255.1020408163265,
          255.1020408163265,
          255.1020408163265,
          255.1020408163265,
          222.4071269132653
        ],
        "pressure_pa": [
          4000.0,
          6500.0,
          9000.0,
          11500.0,
          14000.0,
          16500.0,
          19000.0,
          21500.0,
          24000.0,
          26500.0,
          29000.0,
          31500.0,
          34000.0,
          36500.0,
          39000.0,
          41500.0,
          44000.0,
          46500.0,
          49000.0,
          51500.0,
          54000.0,
          56500.0,
          59000.0,
          61500.0,
          64000.0,
          66500.0,
          69000.0,
          71500.0,
          74000.0,
          76500.0,
          79000.0,
          81500.0,
          84000.0,
          86500.0,
          89000.0,
          91500.0,
          94000.0,
          96500.0,
          99000.0
        ],
        "specific_humidity_kg_kg": [
          8.182293840189623e-06,
          4.460808479895518e-06,
          8.94046869814514e-07,
          2.9357869602352368e-06,
          1.1326602889248693e-05,
          3.4799344520490224e-05,
          8.985550125830252e-05,
          0.0001908037120796436,
          0.00033584931386422133,
          0.0005442734550541961,
          0.0008666876497762329,
          0.0012924272778474784,
          0.0016175816124954512,
          0.0021185025637086474,
          0.0027261178269306183,
          0.0033417011038061515,
          0.004034125497313666,
          0.004758724665774046,
          0.005406020394189504,
          0.005984736874286492,
          0.0066687290366904675,
          0.007058248322783947,
          0.00748858107981586,
          0.008042600253512312,
          0.008745655531775726,
          0.009507801656325249,
          0.01022032356122806,
          0.011057567864995023,
          0.012038681249902448,
          0.012906470809573639,
          0.013968376356246264,
          0.014729619114927935,
          0.01568573720761148,
          0.01656568586528322,
          0.017336089431007572,
          0.018356873261133777,
          0.019181613720050245,
          0.019764003053410598,
          0.0207017809790926
        ],
        "surface_pressure_pa": 99929.58984375,
        "temperature_k": [
          206.96200561523438,
          193.39599609375,
          184.57200622558594,
          192.87399291992188,
          203.1009979248047,
          212.20700073242188,
          220.3560028076172,
          227.6060028076172,
          233.7779998779297,
          239.39599609375,
          244.37600708007812,
          248.76800537109375,
          252.78900146484375,
          256.2619934082031,
          259.2409973144531,
          262.04400634765625,
          264.5570068359375,
          266.802001953125,
          268.97100830078125,
          270.8890075683594,
          272.8559875488281,
          274.75,
          276.7690124511719,
          278.8089904785156,
          280.7969970703125,
          282.6130065917969,
          284.0559997558594,
          285.52398681640625,
          287.0400085449219,
          288.35699462890625,
          289.6419982910156,
          291.0719909667969,
          292.4259948730469,
          293.6310119628906,
          294.989013671875,
          296.3089904785156,
          297.7149963378906,
          298.989013671875,
          300.1080017089844
        ],
        "terrain_height_asl_m": 29.899999618530273,
        "valid": [
          true,
          true,
          true,
          true,
          true,
          true,
          true,
          true,
          true,
          true,
          true,
          true,
          true,
          true,
          true,
          true,
          true,
          true,
          true,
          true,
          true,
          true,
          true,
          true,
          true,
          true,
          true,
          true,
          true,
          true,
          true,
          true,
          true,
          true,
          true,
          true,
          true,
          true,
          true
        ]
      },
      "time_utc": "2006-01-23T12:00:00Z"
    },
    {
      "independent_reference": {
        "cloud_base_mass_flux_kg_m2_s": 0.09103513709397851,
        "downward_interface_mass_flux_kg_m2_s": [
          0.0,
          0.0011355804732787777,
          0.062451406351576144,
          0.12169125413485818,
          0.12172211327957967,
          0.11667186360552782,
          0.11076758109122464,
          0.10520066466007143,
          0.1013208146500138,
          0.098699479803224,
          0.096886932986535,
          0.09431872820680956,
          0.09141675964789857,
          0.08905311469448708,
          0.09032623177583034,
          0.08934462499433722,
          0.08950349205826905,
          0.08949859215321916,